{
  "batch_id": "001_verbs_conjugations_batch_001",
  "collection": "verbs",
  "contract_version": "1.0.0",
  "baseline_hash": "sha256:88b63cae956e98a70e2104deac631938bad86b8b1c071afd54c00b5868597861",
  "source_allowlist_version": "1.0.0",
  "patches": [
    {
      "entity_key": "abandonner",
      "field": "conjugations",
      "operation": "set_if_missing_complete",
      "precondition": {
        "field_state": "EMPTY"
      },
      "evidence": {
        "source_id": "bescherelle_la_conjugaison_pour_tous",
        "source_type": "reference_lexicon",
        "reference_notes": "1st group regular paradigm verified against Bescherelle index"
      },
      "value": [
        {
          "tense": "présent",
          "mood": "indicative",
          "forms": {
            "je": "abandonne",
            "tu": "abandonnes",
            "il_elle_on": "abandonne",
            "nous": "abandonnons",
            "vous": "abandonnez",
            "ils_elles": "abandonnent",
            "imperative_tu": null,
            "imperative_nous": null,
            "imperative_vous": null,
            "impersonal_form": null
          },
          "stems": [
            {
              "tense": "présent",
              "persons": [
                "all"
              ],
              "stem": "abandonn",
              "note": null
            }
          ],
          "endings": [
            "e",
            "es",
            "ons",
            "ez",
            "ent"
          ],
          "formation_note": null,
          "irregularities": [],
          "notes": [],
          "sources": [
            {
              "source_type": "verb_table",
              "source_name": "bescherelle_la_conjugaison_pour_tous",
              "chapter_number": null,
              "section_title": null,
              "page_printed": null,
              "page_pdf": null,
              "context_type": null,
              "exercise_code": null,
              "question_number": null,
              "table_title": "abandonner_table",
              "table_type": null,
              "row_label": "abandonner",
              "column": null,
              "direction": null,
              "source_headword": "abandonner",
              "source_target": null,
              "source_text": null,
              "created_by": "ai_enrichment",
              "notes": null,
              "derived_from": [],
              "source_classifications": []
            }
          ]
        },
        {
          "tense": "imparfait",
          "mood": "indicative",
          "forms": {
            "je": "abandonnais",
            "tu": "abandonnais",
            "il_elle_on": "abandonnait",
            "nous": "abandonnions",
            "vous": "abandonniez",
            "ils_elles": "abandonnaient",
            "imperative_tu": null,
            "imperative_nous": null,
            "imperative_vous": null,
            "impersonal_form": null
          },
          "stems": [
            {
              "tense": "imparfait",
              "persons": [
                "all"
              ],
              "stem": "abandonn",
              "note": null
            }
          ],
          "endings": [
            "ais",
            "ait",
            "ions",
            "iez",
            "aient"
          ],
          "formation_note": null,
          "irregularities": [],
          "notes": [],
          "sources": [
            {
              "source_type": "verb_table",
              "source_name": "bescherelle_la_conjugaison_pour_tous",
              "chapter_number": null,
              "section_title": null,
              "page_printed": null,
              "page_pdf": null,
              "context_type": null,
              "exercise_code": null,
              "question_number": null,
              "table_title": "abandonner_table",
              "table_type": null,
              "row_label": "abandonner",
              "column": null,
              "direction": null,
              "source_headword": "abandonner",
              "source_target": null,
              "source_text": null,
              "created_by": "ai_enrichment",
              "notes": null,
              "derived_from": [],
              "source_classifications": []
            }
          ]
        },
        {
          "tense": "futur_simple",
          "mood": "indicative",
          "forms": {
            "je": "abandonnerai",
            "tu": "abandonneras",
            "il_elle_on": "abandonnera",
            "nous": "abandonnerons",
            "vous": "abandonnerez",
            "ils_elles": "abandonneront",
            "imperative_tu": null,
            "imperative_nous": null,
            "imperative_vous": null,
            "impersonal_form": null
          },
          "stems": [
            {
              "tense": "futur_simple",
              "persons": [
                "all"
              ],
              "stem": "abandonner",
              "note": null
            }
          ],
          "endings": [
            "ai",
            "as",
            "a",
            "ons",
            "ez",
            "ont"
          ],
          "formation_note": null,
          "irregularities": [],
          "notes": [],
          "sources": [
            {
              "source_type": "verb_table",
              "source_name": "bescherelle_la_conjugaison_pour_tous",
              "chapter_number": null,
              "section_title": null,
              "page_printed": null,
              "page_pdf": null,
              "context_type": null,
              "exercise_code": null,
              "question_number": null,
              "table_title": "abandonner_table",
              "table_type": null,
              "row_label": "abandonner",
              "column": null,
              "direction": null,
              "source_headword": "abandonner",
              "source_target": null,
              "source_text": null,
              "created_by": "ai_enrichment",
              "notes": null,
              "derived_from": [],
              "source_classifications": []
            }
          ]
        },
        {
          "tense": "passé_simple",
          "mood": "indicative",
          "forms": {
            "je": "abandonnai",
            "tu": "abandonnas",
            "il_elle_on": "abandonna",
            "nous": "abandonnâmes",
            "vous": "abandonnâtes",
            "ils_elles": "abandonnèrent",
            "imperative_tu": null,
            "imperative_nous": null,
            "imperative_vous": null,
            "impersonal_form": null
          },
          "stems": [
            {
              "tense": "passé_simple",
              "persons": [
                "all"
              ],
              "stem": "abandonn",
              "note": null
            }
          ],
          "endings": [
            "ai",
            "as",
            "a",
            "âmes",
            "âtes",
            "èrent"
          ],
          "formation_note": null,
          "irregularities": [],
          "notes": [],
          "sources": [
            {
              "source_type": "verb_table",
              "source_name": "bescherelle_la_conjugaison_pour_tous",
              "chapter_number": null,
              "section_title": null,
              "page_printed": null,
              "page_pdf": null,
              "context_type": null,
              "exercise_code": null,
              "question_number": null,
              "table_title": "abandonner_table",
              "table_type": null,
              "row_label": "abandonner",
              "column": null,
              "direction": null,
              "source_headword": "abandonner",
              "source_target": null,
              "source_text": null,
              "created_by": "ai_enrichment",
              "notes": null,
              "derived_from": [],
              "source_classifications": []
            }
          ]
        },
        {
          "tense": "conditionnel_présent",
          "mood": "conditional",
          "forms": {
            "je": "abandonnerais",
            "tu": "abandonnerais",
            "il_elle_on": "abandonnerait",
            "nous": "abandonnerions",
            "vous": "abandonneriez",
            "ils_elles": "abandonneraient",
            "imperative_tu": null,
            "imperative_nous": null,
            "imperative_vous": null,
            "impersonal_form": null
          },
          "stems": [
            {
              "tense": "conditionnel_présent",
              "persons": [
                "all"
              ],
              "stem": "abandonner",
              "note": null
            }
          ],
          "endings": [
            "ais",
            "ait",
            "ions",
            "iez",
            "aient"
          ],
          "formation_note": null,
          "irregularities": [],
          "notes": [],
          "sources": [
            {
              "source_type": "verb_table",
              "source_name": "bescherelle_la_conjugaison_pour_tous",
              "chapter_number": null,
              "section_title": null,
              "page_printed": null,
              "page_pdf": null,
              "context_type": null,
              "exercise_code": null,
              "question_number": null,
              "table_title": "abandonner_table",
              "table_type": null,
              "row_label": "abandonner",
              "column": null,
              "direction": null,
              "source_headword": "abandonner",
              "source_target": null,
              "source_text": null,
              "created_by": "ai_enrichment",
              "notes": null,
              "derived_from": [],
              "source_classifications": []
            }
          ]
        },
        {
          "tense": "subjonctif_présent",
          "mood": "subjunctive",
          "forms": {
            "je": "abandonne",
            "tu": "abandonnes",